,id,date,topic_id,topic_prob,year,url,article,top_terms,MainTopic,rep_docs,HumanJudgement,Correct,Accuracy,
6,1357254,9/24/2014,25,0.557693,2014,https://timesofindia.indiatimes.com/city/chandigarh/traders-rue-poor-facilities-at-attari-icp-suspend-operations/articleshow/43277449.cms,"ATTARI: Eid and Diwali celebrations could be hit in India and Pakistan with importers and exporters declaring indefinite suspension of trade with Pakistan owing to poor infrastructure at India's only integrated check post (ICP) at Attari.  However, traders on Tuesday allowed around 100 truckloads of tomatoes to cross the border to prevent losses to Indian traders while around 50 trucks of cement arrived from Pakistan. Goods worth Rs 350 crore are traded monthly between the two countries through ICP.  The traders' association and Attari Truck Operators' Union have joined hands to suspend trade demanding proper facilities at the ICP.  In the wake of Eid, there was huge demand for tomatoes, vegetables and meat in Pakistan. Similarly dry fruits were in huge demand in India. But the festivities could be hit due to the indefinite strike at ICP, said president of Federation of Karyana and Dry Fruit Commercial Associations and an importer and exporter, Anil Mehra. No trader wanted to suspend trade, but they were forced to do so since they had to bear losses, he said.  President of Cement Importers' Association, M P Singh Chatha, said, ""Central Warehousing Corporation (CWC) has failed to provide proper infrastructure at ICP due to which trade with Pakistan was not flourishing. We need goods in the same condition in which they are sent by Pak exporters, but goods often get damaged here due to carelessness of CWC.""  He also blamed CWC for charging demurrage as and when truck enters from Pakistan. ""We should be given at least 72 hours' time for clearance and loading of goods,"" he said.  Executive member of truck union Parminder Singh said that sometimes they have to wait for three days for their turn for clearance of goods. He said only drivers are allowed to go inside ICP and not the helper and in case of rain, driver alone couldn't cover the truck with tarpaulin. When the goods are damaged in rain, dealers often ask transporters to pay compensation, he said.  Truck driver Amarjit Singh said there was only one weighing machine at ICP and hundreds of trucks queue up for weighing, making it a time-consuming exercise. ""We have to stay inside ICP for clearance for more than six hours and there is no basic infrastructure for us like toilet or canteen,"" he said.  CWC manager Rameshwar said, ""We have all the space and infrastructure at ICP"". On charges by traders about Pak cement or other goods getting damaged in rain, he said many a time, Pak customs or Rangers also check the goods and remove the tarpaulin from the truck. If it rains then, the goods were bound to get wet in rain.  Similarly, he said, when trucks from Pakistan cross Indian border, the tarpaulin was removed for rummaging and other security checks. ""We can't help if it rains then, but these are very rare incidents,"" he said. There were certain technical reasons like formalities of customs clearance, etc., which takes time. ""Transporters and traders are not ready to understand these issues,"" he said.  BOX  Rs 150-crore complex  Former home minster P Chidambaram had laid the foundation stone for ICP on February 20, 2010, with a view to boost trade and commerce between India and Pakistan. It was constructed at a cost of Rs 150 crore on 130 acres of land acquired by the Punjab government. On April 13, 2012, Chidambaram had inaugurated the ICP.  Box  Main trade items  Goods, including fresh vegetables, soybean, cotton, polypropylene, polyethylene, carbon dioxide, etc., are exported to Pakistan while items like cement, soda ash, gypsum, glass, rags, sugar and dry dates were imported from Pakistan via ICP.  BOX  Meeting today  Keeping in view the Indo-Pak trade crisis, especially so ahead of the festive season, the custom officials have convened a meeting of representatives of traders, truck operators, CWC and civil administration. The meeting will be held on Wednesday, said president of Cement Importers Association MP Singh Chatha. ","['land', 'housing', 'estate', 'developer', 'property', 'flat', 'real', 'plot', 'development', 'builder']",RealEstate,new delhi development authority putting seal approval policy meeting people already lured buying builder actually plan policy real estate expert worry builder luck shortchanging potential buyer offering home land new land policy free urban mostly periphery small landholding village surrendered create infrastructure like road return substantial portion land last delhi government declared village urban village eligible land area covering village north delhi divided like dwarka emerge pooled real regulation requiring certain norm building developer soliciting buyer presumption land available book ask office call process builder confided toi reporter posed potential flat though project cannot launched without obtaining building plan sanctioned registration formality gullible buyer committed money housing exist developer fraudulently collected lakh advance payment interested builder shut shop vanished collecting huge cautioned mukesh advised buyer verify document credibility developer investing dda aware initiated communication programme clarify policy yet become unscrupulous promoter opened kiosk dwarka locality neighbouring distribute pamphlet brochure promoting housing said dda dda official received text message scheme,India-Pakistan,No,,
7,1345047,8/31/2014,78,0.961727,2014,https://timesofindia.indiatimes.com/entertainment/events/mumbai/vj-andy-and-elli-avram-at-the-launch-of-fling-with-bling-collection/articleshow/41269364.cms,"Designer Salima Lalani presented her ‘Fling with Bling’ collection recently, amidst a gathering attended by her friends and patrons. The collection features creations that are a fusion of Indian drapes on western silhouettes and vice versa.   	The gowns in the new line combine sari pleats along with lehengas worn with cowled crop tops. Also present were Lavinia Chetan Hansraj and Sandhya Shetty.  	The collection has been blinged up with sequins and Swarovski crystals in bright colours like coral, turquoise and fuschia. Salima will present this collection at the India Fashion Week in Dubai soon.  ","['fashion', 'designer', 'collection', 'design', 'ramp', 'show', 'couture', 'model', 'khadi', 'colour']",LIfeStyle,ahmedabad slated first major fashion fiesta coming extravaganza tata indicom ahmedabad fashion bring together best budding fashion corporate head set undisputed king event fashion conference fashion advisor umang hutheesing said kind event long overdue rich textile fashion week hope fashion week year brainchild hutheesing meeta budding event start april glitzy display select creation budding designer including like rahul mishra nachiket creation subsequently display hutheesing visual art centre april interesting aspect event trainee designer design school like nid nift opportunity interaction high time realised fashion merely glamour way event much getting glitterati chatterati give platform labour provide impetus textile tradition like chikan sparked renewed say,LIfeStyle,Yes,,
8,1468029,5/4/2015,55,0.999873,2015,https://timesofindia.indiatimes.com/city/delhi/raj-era-church-banks-on-people-for-facelift/articleshow/47143568.cms," NEW DELHI: The Cathedral Church of Redemption traces its origin to the early 1900s. Built in eight years and completed in 1931, the church has high arches and delicate domes and is said to resemble a birthday cake with a candle placed on top. For the first time, it will undergo a comprehensive conservation programme conducted by the church committee under the supervision of India National Trust for Art and Cultural Heritage. The project is being completely funded through donations by churchgoers.  Located east of Parliament House and Rashtrapati Bhavan which was used by the British Viceroy, the Cathedral Church of Redemption derives its name from Palladio's Church of Il Redentore in Venice. According to historians, the church’s centralized plan blends neatly with Sir Edwin Lutyens’ city plan.  “With Viceroy Lord Irwin’s keen support, the church, built according to Henry Alexander Medd’s (1892-1977) design, was opened for public worship on Sunday, January 18, 1931. Medd’s design was inspired by the Palladio Church of Il Redentore in Venice as well as Lutyens’ Hampstead church,” reads a description of the building. Through the decades, however, the building has suffered wear and tear. While the interiors have seen repairs over the years, this is the first time the exterior façade will be the focus of conservation.  Construction work of the church started in 1927 and was completed in 1931. The domes were added by 1935. “The church was considered a majestic part of the new capital city and has witnessed history. A few years ago, the interiors of the church saw elaborate restoration including rewirings, repairing, flooring and polishing. Now our focus is on the conservation of the exteriors of the church. Church members are all pledging money for the work over a period of a year in installments,” said Rev Paul Swaroop.  The project would cost approximately Rs 1.3 crore. Major areas of concern seen in the church are algae growth, accumulation of dust, water seepage, flaking and disintegration of plaster, vegetation growth, paint layer over fenestrations and at the fixing joints, weathering of red sandstone at plinth and flooring of porches. “The column capitals are also defaced and have stains on them. Superficial cracks can be seen wherever the surfaces have been plastered,” said an official.  According to Reverend Paul Swaroop, the church committee had approached the government several times to conserve the building which is listed as a Grade A heritage building. “In spite of approaching the government several times, we only got empty assurances. We were told during Commonwealth Games that the government would allocate money for the church’s conservation. The committee then decided to take over. Intach was brought in as a consultant. We invited tenders for conservation of the church and evaluated the responses before awarding the contract. Intach will supervise the project,” he said. ","['heritage', 'monument', 'temple', 'site', 'fort', 'archaeological', 'stone', 'museum', 'asi', 'structure']",Heritage,ancient history expert found megalithic menhir basrur udupi providing detail prof said monday tall stone slab found near venkataramana menhir resembles pregnant cannot ascertain built memory deceased pregnant found historically important mean pregnant kannada region important city trade known basaruru temple indicating splendid devi temple basrur special importance probably temple india temple feast performed every said prof temple region mahalingeshwara venkataramana kote anjaneya tuluveshwara devi ramachandra uma maheshwara bhairava garadi sadananda surviving example glorious word menhir adopted french india menhir tall monolithic stone slab often planted memory dead memorial stone mark graf megalithic menhir dated said prof discovery menhir near venkataramana temple basrur close similarity menhir found baise nilskal village shivamogga basrur venkataramana temple trustee murulidhar hegde pradeep basrur supported professor archaeology student ganesh chandru assisted,Heritage,Yes,,
9,2207609,5/23/2019,61,0.784703,2019,https://timesofindia.indiatimes.com/city/pune/man-gets-life-term-for-raping-minor-daughter-repeatedly/articleshow/69450790.cms,"PUNE: A special court on Wednesday sentenced a man to life imprisonment for repeatedly raping his eleven-and-a-half-year-old daughter for four months before September 10, 2015, in his house under the jurisdiction of the Hadapsar police. The convict (name withheld) has been in jail since his arrest on September 12, 2015. The Hadapsar police had chargesheeted him for offences punishable under Section 376 (rape) of the Indian Penal Code and for aggravated sexual assault under the Protection of Children from Sexual Offences (POCSO) Act. Special judge (POCSO Act) G P Agrawal found the accused guilty based on the evidence on record, including the survivor and her brother’s deposition. The judge also relied on the provisions under Section 29 of the POCSO Act, which state that there is presumption of commission of offence unless the contrary is proved. The court directed the district legal service aid authority to take steps for grant of apt compensation to the survivor under the Maharashtra Victim Compensation Scheme. “The victim has suffered enormous mental and physical pain due to the shameful act of her father and, therefore, she needs to be adequately compensated in terms of money,” judge Agrawal said. Special public prosecutor Suresh Gawali had examined six witnesses — the survivor’s mother, who had lodged an FIR against the accused, the survivor, her brother, the medical experts examining the girl and investigating officer Rupali Pawar — in support of the prosecution’s case. The accused claimed that he was falsely implicated by his wife, who had previously lodged a case against him for subjecting her to cruelty, and he was acquitted in that case. He took the defence that the girl’s age was not adequately proved, there was a two-day delay in the registration of the FIR and the girl’s medical examination did not support the prosecution’s case. Gawali had argued that the survivor and her brother’s statements were consistent, their conduct was natural, and they had no reason to falsely implicate their father. The court observed that there were no material contradictions in the deposition by star witnesses — the survivor and her brother — and there was no reason to disbelieve their testimonies. The judge also cited the Supreme Court rulings to the effect that in sexual crime against woman, the survivor’s testimony if found cogent, consistent and reliable, alone is sufficient for conviction of the accused. The court also relied on the complainant-mother’s evidence, and the findings of the medical experts and the investigating officer. ","['court', 'rape', 'imprisonment', 'accused', 'sentenced', 'judge', 'case', 'crime', 'sexual', 'victim']",CrimeAgainstWomen,fast track special court sewri thursday sentenced seven person life imprisonment convicting murder ali hussain nanjiyani owner local news tehelka killed property dispute underworld dawood brother noora ibrahim near model town versova november investigating officer inspector bapurao mahadik said murder conspiracy hatched gangster chhota shakeel accused given contract lakh eliminate caught day murder behram baug mahadik assistant inspector part investigation said nanjiyani noora business associate bought plot nanjiyani sold plot give noora enraged noora help chhota shakeel got,CrimeAgainstWomen,Yes,,
10,760903,11/9/2011,53,0.999641,2011,https://timesofindia.indiatimes.com/city/goa/poachers-arrested-in-sattari-granted-bail/articleshow/10660904.cms," KERI: Poachers Rajan Naik and Sunil Gaonkar who were arrested by forest officials were granted bail by a JMFC court on Sunday and asked to report to the office of the range forest officer, Valpoi, for five days for a further investigation. Rajan Naik from Narayan nagar, Honda, and Sunil Gaonkar from Bhuipal, Sattari, were nabbed by patrolling forest guards for attempting to poach wild animals at the Mhadei wildlife sanctuary on the night of November 6. The forest officials also found a gun, bullets and knives in their car. Though the accused were asked by the forest officials to stop their vehicle to get it checked, the duo attempted to flee. However, after a chase, the forest officials successfully nabbed them. Range forest office of the Mhadei wildlife sanctuary Vishwas Chodankar said, ""The duo was taken into custody under Section 31 of the Wildlife Protection Act 1972, since both of them had entered the sanctuary with weapons without a written permission from the chief wildlife warden or an authorized officer.""","['tiger', 'forest', 'leopard', 'elephant', 'wildlife', 'animal', 'reserve', 'wild', 'cub', 'cat']",WildLIfe & Planet,new master poacher sansar judicial meticulously planned poaching including sariska poaching probe case revealed planned sariska debacle took place poacher helper walking fearlessly bloody cbi belief blatant operation carried without knowledge least section forest guard deployed keep vigil probing possible connivance organised massacre last tiger sariska national step away well truly cbi chand emerged kingpin international organised racket involving poaching illegal trade wildlife product like pug enough evidence nail cbi spokesperson criminal caught proven already strong evidence sansar cbi verifying activity gang uttar madhya andhra apart product reached chand delhi several dispatched false invoice porous nepal border state like uttar bihar west inspected prospective buyer border marked tibetan script physically carried porter nepal dense chand wanted least six different state case pending,WildLIfe & Planet,Yes,,
11,1547669,10/10/2015,0,0.842367,2015,https://timesofindia.indiatimes.com/city/chandigarh/pu-prepares-to-pay-das-ahead-of-festival-season/articleshow/49297046.cms,"CHANDIGARH: After his meeting with officials of the Ministry of Human Resource and Development (MHRD) on Friday, Panjab University (PU) vice-chancellor (VC) Arun Kumar Grover said the grant for the university was likely to be released very soon by the University Grants Commission (UGC). ""The grant will not be delayed any more by MHRD or UGC. MHRD is already very concerned about the difficulty being faced by PU in releasing salaries and pensions for teachers and all other staff,"" said Grover. The VC visited Delhi in the backdrop of the university's grants from the UGC getting stuck. As a result, the university has been unable to pay dearness allowances, and pensions were getting delayed. However, it is making arrangements to pay DAs in view of the upcoming festival season. PU registrar Col (retired) GS Chadha said the final details of specific observations by the fact finding-committee have been submitted, and that exercise would be completed by Tuesday. ""The university is hopeful that first instalment of the central grant will be released soon to PU. The university is conscious of the employees' expectations in the festival season, and is trying hard to disburse their dues as soon as possible. We have asked the finance department to include the DA while preparing their pay cheques. The exercise is being done to avoid any delay in disbursement of dues,"" he added.","['student', 'school', 'education', 'teacher', 'class', 'college', 'university', 'admission', 'exam', 'course']",Education,candidate thronged government school city apply teaching post might fall temporarily vacant monday due ongoing strike government state school education department earlier announced government teacher drop protest lose posting replaced temporary retired staff consolidated pay state protesting teacher return work monday face disciplinary proceeding might work different school depending vacancy bear pay cut absence till sunday teacher suspended participating protest case registered unlawful public wrongful restraint deterring public servant discharge boycotted work application invited temporarily fill vacancy applied till sunday according official joint action committee tamil nadu teacher employee organization reiterated continue protest till demand indefinite strike since pressing charter including revival old pension pay par central government teacher payment month rejected claim state fishery minister jayakumar increasing pay scale toll amount spent towards welfare state school education expressed willingness hold talk resolve issue functioning school since school fully functional due high rate absenteeism among besides primary higher secondary student left though practical exam board begin next preparatory work standstill,Education,Yes,,
12,673433,5/16/2011,0,0.910338,2011,https://timesofindia.indiatimes.com/india/jk-farmers-daughter-cracks-ias/articleshow/8353161.cms," SRINAGAR: Failing twice to clear the IAS examination did not deter Ovessa Iqbal from trying again to break into the coveted civil services as she felt it was the only way she could change the lives of people of her state Jammu and Kashmir. Iqbal, hailing from remote Chachoot village in Ladakh, is among the seven successful candidates from the state to have cracked the Union Public Service Commission examination this year and the first Muslim woman from the state to make it the prestigious civil services list. It was not an easy ride for 25-year-old Iqbal, whose father is a farmer, as a big disadvantage was having been born in Ladakh, a region which is gripped by intense cold for six months of winter and remains cut off from rest of the world due to heavy snowfall. After finishing her Bachelor’s Degree in Chemical Engineering, she had the option of studying MBA like her classmates at college in Chandigarh but the desire to serve her own people pushed her to work towards the Civil Services goal. ","['student', 'school', 'education', 'teacher', 'class', 'college', 'university', 'admission', 'exam', 'course']",Education,candidate thronged government school city apply teaching post might fall temporarily vacant monday due ongoing strike government state school education department earlier announced government teacher drop protest lose posting replaced temporary retired staff consolidated pay state protesting teacher return work monday face disciplinary proceeding might work different school depending vacancy bear pay cut absence till sunday teacher suspended participating protest case registered unlawful public wrongful restraint deterring public servant discharge boycotted work application invited temporarily fill vacancy applied till sunday according official joint action committee tamil nadu teacher employee organization reiterated continue protest till demand indefinite strike since pressing charter including revival old pension pay par central government teacher payment month rejected claim state fishery minister jayakumar increasing pay scale toll amount spent towards welfare state school education expressed willingness hold talk resolve issue functioning school since school fully functional due high rate absenteeism among besides primary higher secondary student left though practical exam board begin next preparatory work standstill,Education,Yes,,
